text;emotion
im not one of those people who can bury all their feelings and anger just in a second giving out a sweet smile even when in pain and anger;love
i knew it was the holy spirit at work plus it feels divine in the gooooood way like a massage reassuring me;joy
i feel as though ive reached a point in my career where im highly respected there;joy
i make light of it but sometimes i feel really awkward in small groups and in one on one conversations;sadness
ive had a lot of good days where i feel fabulous and have lots of energy but lately ive also had some bad days where i feel gigantic and slow and clumsy;joy
i also feel like if google hated seo we d know it;sadness
i didnt get a wink of sleep that night and continued feeling not so fabulous the next morning;joy
i feel like you feel this is a mistake but time is fucked up sleep won t take;anger
i love sliding down on a nice big throbbing cock and feeling what my gorgeous body does to a man;joy
i found myself in the novel position of feeling a bit uncertain about the stock market rally;fear
i feel like she s judging me and he s not here and i don t want to seem like the needy girl so i don t know;sadness
im definitely feeling festive;joy
i feel burdened by her presence;sadness
i still feel a little dazed and have that sort of disbelieving feeling of oh my god;surprise
i am feeling super excited as the weeks seem to be flying by and we are getting closer and closer to our due date;joy
i have turned that page i feel like there is no way of getting back my irresponcible years of carefree college;joy
i have a few favourites of my own but the choice of book is up to you or you can have a dvd if you are us or uk im feeling generous so the limit is up to which is about something like that;love
i am feeling more energetic more alive happier than i have in a long time;joy
i feel really pathetic confronted with some;sadness
i feel there are dangerous games or activities;anger
i feel a world class player in the benzema mould would be fantastic;joy
i am feeling terribly burdened by impending anxiety i am trying to just keep my eyes on the prize;sadness
i feel could be unpleasant is layered with love healing forgiveness and the expectation that things will turn out well;sadness
im feeling gloomy as i have completed nothing though im supposed to complete many things;sadness
i am not working out the amount i would like to i feel like my lifestyle change has been successful so far;joy
i love the porn industry and i feel satisfied and fulfilled working in it i have to say that it doesn t really bring in the big bucks;joy
i overhear the victory tune on some geeks ringtone i feel triumphant;joy
i love children s literature authors who don t feel the need to dumb down things for kids;sadness
i was soo quiet it was a mixture of not sleeping well and feeling a bit isolated from the big group;sadness
i do feel that they are greedy and money hungry absolutely;anger
i feel so fucked up now i want to shut myself up;anger
i feel very passionate about a certain topic i love backing up my position with actual knowledge and facts instead of relying solely on opinions;joy
i feel like today is way suffering than the exam day which we have to open books everytime we went home;sadness
i feel surprised by how down it makes me;surprise
i woke up the morning of our hike feeling jubilant;joy
i feel like a little kid whose mom is proud that they touched the soccer ball once during the game;joy
i feel miserable on the inside but on the outside i just like i;sadness
i must find a way to accept these limitations until they are older without feeling held back or resentful;anger
i feel incredibly charmed that i have these people in my life and that i am at such an exciting amazing chapter of things;joy
i feel wronged but the judges people make at times however i also found out that actually in life we just need to be responsible to our own actions and and the people around us;anger
i know those feelings stem from this part of me that is not accepted mainstream more importantly in the communities to which i seek belongingness;joy
i really like how the special edition really does feel special with songs on it;joy
i feel as if i must blog constantly for all my loyal fans the baker thia sandwich the scruncher and of course mini t rex;love
im currently feeling way fucked up with the mother tongue paper;anger
i feel your innocent love;joy
i feel like having that sweet carby yet low glycemic meal not just at breakfast but often for dessert;joy
i feel safe encoding utf locale en isprivate false ismobile false mobileclass isprivateblog false languagedirection ltr feedlinks link rel alternate type application atom xml title i could use a standing ovation could you;joy
i really lose a lot of my nesting homemaking instinct and desire when i am pregnant and the longer im pregnant the worse it gets though i do get about a month reprieve where i feel creative again around the six month mark and youll notice that is when i did a post for halloween;joy
i feel as if this opportunity to return to moz is gods gracious gracious way of giving me that heat desire despite my own self doubt and uncertainty in the past;joy
i feel really lucky to have found you as a resource and have always felt the answers i needed were there for the asking;joy
i keep running up the hill and fitness wise feel fine but along with my foot my calves are starting to now hurt also as they begin to tire;joy
i am always so sensitive and my every sense feels like it is being assaulted as i drag myself away from the darkness;fear
i supposed i ought to feel thankful for that adding with a sarcastic edge at my age;joy
i couldnt help but feel totally distraught and utterly helpless when lorena was kidnapped and tortured almost to death by a band of enemies i was desperate for her freedom;fear
i feel i was unfortunate with both mister magnum and sounds of cheers travelling well for long periods of the race;sadness
i feel tortured and tragic enough as it is without having any importance or sparkle;anger
i feel selfish thinking this way but i feel so lonely at times;anger
i feel drained of energy;sadness
i just think about all the day i chatted with my mom amp also feeling horny and masturbate myself;love
i am feeling pretty stinkin shitty for being such a horrible reviewer;sadness
i feel helpless about it;sadness
i was feeling awful on sunday;sadness
i dont know why but i had started to feel the weird pressure of a largely silent audience and with it a falsely inflated sense of importance in expressing myself and my ever so articulate opinions to said audience;surprise
i just woke up from my nap and i feel extremely agitated and grumpy;fear
ive been studying really hard for it and discovering pretty words that never crossed my mind and how they portray the exact meaning and i feel like ive missed out a lot;sadness
i feel lonely at work im not a social bird as i usually am when i was in school;sadness
i love comments so feel free to post one;joy
i feel intimidated by the great women in my family tree;fear
i truly feel that they do a lot of positive things to help the conditions for the workers and their families kids;joy
i think this may be the reason i would want to fly back to uae because there i can be oblivious of these conflicts that plague me conflicts that i feel helpless resolving;sadness
i saw the video of cena kissing maria and surprisingly i didnt feel like i hated her;sadness
i feel like i have been rather unkind to it;anger
i was not feeling submissive;sadness
i do feel a bit obnoxious it is definately the weather;anger
i says pressing his torso against siwons and bringing their faces close enough that he can feel siwons agitated breath;anger
i had been indifferent to tell the feelings and words i had treasured ever since the feeling start to bloom are one of the moments i want to keep;love
i feel hes being very casual with my entire future;joy
i was still feeling strong but i missed a couple lifts;joy
i sat on my couch for several hours feeling pretty low;sadness
i checked on you was a long time ago i can say you were happy way back then feeling contented with everyone and everything around you;joy
i write him when something big has happened like a fun trip or milestone and other times i just write him to tell him how im feeling about his sweet baby snuggles or growing personality;joy
i hate the expectation that i must need a man in my life to feel worthwhile or valued;joy
i did feel that loving kindness allow us to think and feel how our conscious and how we interact with various things in the body and mind;love
i feel completely blessed to be a part of this group;love
im the type who doesnt use a moisturizer as my skin is too oily so this product is designed to contain a ton of moisturizing ingredients that will make my skin feel lovely without oils;love
im afraid im in an environment that makes me feel more relaxed cause;joy
i am feeling overwhelmed i want to physically shake everything off me the way i would if there was a spider in my shirt;surprise
i will say that a little piece of me feels agitated when i watch discussions on race and there will i style color font family georgia serif font size px line height;fear
i can feel but i cant touch you said my love was a bit too much i wont deny it broke my heart cant find no crush so why dont you come on back home;sadness
i feel a little frustrated an ache of longing has settled into my heart the weariness of life his slipped around my shoulders like an unwelcome friend;anger
i even remember trying them on last year and feeling crappy because i was nowhere near closing them;sadness
i broke my uncles radio player accidentally and so i feared that he was going to cut me off from going to his house as well as playing it again;fear
i have been feeling conflicted on whether or not i as a follower of christ should celebrate the ever popular pagan originated modern day holidays;joy
i was feeling impatient and took pills;anger
i feel carefree and weightless and yet worried and grounded all at the same time;joy
i feel he is sincere and repentant for his past opposition to civil rights;joy
i did at one point put my son in daycare but my mom constantly made me feel like a terrible parent because of it;sadness
i only have a few things on my list i feel super guilty and can t relax;joy
i feel uncertain about his motives and feel an inbalance in our committment to the process of counselling for reconciliation;fear
i feel like i am really valuable to him;joy
i feel like my go to emotion is angry;anger
ive had too much training in grammar and language and reading something written like this kind of feels like im being assaulted;sadness
i is feeling insulted because everyone is comparing sneha with her;anger
i still wake up every morning feeling so blessed to be here and unable to believe im lucky enough to be able to call this amazing family mine for life;joy
i feel as if the leaders of countries do not depict the people of their countries because for the love of god i hope no one thought at all i was in any way supportive or like george w;love
i was feeling really horny all afternoon with no one to fulfill ma sexual desire and only had my bed and creative thoughts to help me out and not forgetting my handss which aahhh work like magic;love
i know scones are not a must have food but i am determined to live a frugal lifestyle without feeling deprived;sadness
i giggle nervously when i feel threatened;fear
i feel that horrible helplessness to make things better for them and that feels like it will kill me inside;sadness
i have a few more of these but after taking pictures of my house i feel it is far too messy to post photos online so ill clean up a bit before i post those;sadness
i feel hated loathed;sadness
i picked up feeling a little apprehensive;fear
ive been feeling very numb;sadness
im feeling every bit the spiteful vindictive bitch i can be at times;anger
i got a feeling by the look in her eyes that she was sincere;joy
i feel assured that my mind is not one;joy
i feel that is very unfortunate that i dont own the soundtrack;sadness
i can t believe it i feel so nervous but my father reassures me that there is nothing to be nervous about which only makes me more nervous;fear
i feel uptight my day is complete when hes around i feel so right a little nervs i dream about what we can do date and all the things we can pursue wedding i always dream that your mine very day min;fear
i didn t think that it would come that fast or would come at all but i suppose it is because i feel cranky today;anger
i have the feeling that im going to be stubborn about it;anger
i feel lonely and lost;sadness
i would feel empty;sadness
i start to feel agitated lacking in patience and just down right cranky;anger
i know its easy to twist things to create an explanation and im still not sure i have one but it did help me to feel a little less mad;anger
i am so feeling so rich and yup i know i am so blessed;joy
i didnt tell you because i didnt want you to feel afraid;fear
i love some of it the media coverage but sometime i feel they put an ugly picture;sadness
i feel as though i am being a little neglectful of my fellow bloggers;sadness
i sort of hate glasses because they make my eyes look small and since huge eyes is all i have going for me it was quite an upset but im hoping these bigger frames will make me feel less paranoid;fear
i cant believe the moment where i feel the most useful is when im washing the dishes;joy
i feel distressed music on my mind rewrite fma op;fear
im feeling quite lonely here now and its only monday of half term;sadness
i feel really socially awkward and dont like to get out and meet new people and do things in groups and be adventurous;sadness
i admire athleticism i feel like i would be more entertained if i got to watch severely out of shape people participate in olympic events;joy
i feel horrible because i feel horrible made worse by the fact that i havent gotten to workout;sadness
i would hate to be bit imagine if the secretary is feeling irritable that day eh;anger
i feel it and im unhappy;sadness
i feel like they take time to care for their flowers and are wonderfully loyal to their hive;love
i remember feeling amazed;surprise
i know that i will never see this place again and that would break my heart had not a thick layer of moss encased it in a thick shell muffling all other sharper feelings pleasant or painful;joy
i am a nameless mid s bottom law school graduate who finds himself marginally attached and awash in a sea of overeducated but underpaid indentured peers who feel and were duped by the promise of a better life through debt and modern chemistry;joy
i truly feel what you all contribute to the blog world especially with regard to educating writers is so valuable;joy
i feel like it would be too clever and get into a ton of things all the time;joy
i know shes right because i feel more energetic awake patient and happy when im running daily but i still feel a little bad too because i believe breast milk is so much better for babies than formula;joy
i quickly trotted off he added i feel embarrassed to ask hoping i would enter into some kind of conversation with him;sadness
i hated that when i got drunk the whole next day was spent sleeping and feeling groggy;sadness
i love the discussions in the class and feel passionate about feminist issues but when i go to write it down it feels as though i am faking it;love
i would want to welcome into my home if i end up feeling my mommyhood threatened by my inability to breastfeed my baby;fear
i feel agitated and the result is not pleasant the opposite of calm and peaceful;anger
i feel so honored that students come to my classes;joy
i often tell him that i want attention from him especially when i feel horny and want to have good sex for hours;love
i get an anxious feeling i feel xox soon itll be the real thing already so i need to be flawless;joy
i feel very rich very blessed very joyful;joy
i had horrible anxiety dreams every night last week and it made me feel really paranoid and of course all of that reading about conspiracy theories and unsolved crimes online didnt hugely help matters;fear
i truly feel but its somehow not enough for me to hate him or to get mad;anger
i remember feeling uncertain about myself when i was young and especially when i became a teenager;fear
i feel is that i cant get far enough away from what feeds melancholy for long enough that it would just wither and die off;sadness
i want to enter in defiance but coming from a different culture i feel offended that i am not allowed;anger
i was feeling rebellious so i ate it;anger
i do feel agitated restless or on edge quite often;anger
i feel uncomfortable using the word awesome but this idea actually is;fear
im feeling rather pleased with myself tonight because i did that;joy
i feel like this leads me to be not as gentle and kind as i should be;love
i feel like i should have actively hated every single second rather than just borne it all;anger
im feeling indecisive and it scares me;fear
i feel a violent tug at my eye socket;anger
i feel so carefree nowwwwww;joy
i believe that what was displayed is a deep emotional yearning for semblance of normality peace since it appears the dancing arabs did not feel threatened by a fully armed soldier;fear
i was left feeling discouraged and hopeless once again;sadness
i feel that this is going to get very messy to get fixed and back on the road again;sadness
i feel frustrated that its not easier other days i remember that the blessing of research learning trial and error hard won success and patience will give me a far better garden in the long run;anger
i was sick with a cold amp not feeling well wondering if i would even be able to have the patience to go to whitleys month photo shoot;joy
i was tempted to feel a little bitter but then i saw this;anger
i feel kind of insecure here anyways back to doha;fear
i am grateful that i no longer feel a frantic urge to fix the emotional upsets of those around me;fear
i feel about strange brew;surprise
i feel quite strongly that students should be punished due to how well or badly they have faired compared to a completely unrelated group of people;sadness
i want to have a job where i am permanent and where i feel like i am valued;joy
i care about someones emotional spiritual and intellectual progress to the point where i feel like i should exert myself in that progress and its important to me that is love;joy
i will actually feel comfortable speaking to others in just japanese i feel pretty happy about my current progress;joy
i learned about different things like how family plan the arrangements and even how real the pain can feel when a loved one passes on;love
i feel at least dating them would not be in vain;sadness
i like keeping a record of my life in written form and pictures and i feel like that is even more important now that i have baby;joy
i do not feel unhappy miserable wretched glum gloomy forelorn or heartbroken;sadness
i really am feeling horribly irritable and a little bit depressed;anger
i feel more than honoured to be part of this series and join all these wonderful and talented ladies in a celebration of the womanhood;joy
i feel more confident about this team right now than i did four hours ago;joy
i simply said how sorry i am and just got out from her car and got into my house feeling restless;fear
ive been feeling a bit paranoid like its really noticable that im off and that everyone can see that;fear
i feel have a fabulous birding weekend everyone;joy
i am at the bus stop and i hear the squeak of a baachan trolley i feel a little paranoid;fear
im feeling rushed and like i should have planned certain things this summer that i can no longer do;anger
i feel that cold breeze;anger
i try to breathe in when i feel frustrated and breathe out the calm that i desire;anger
i feel the language of the warning is pretty benign but i am open to your suggestions on how to improve it;joy
i knew where things was headed but that didnt really prepare me for the heartbreak even i would feel my heart broke for danielle and all other military wives that have had to go thru losing their husband trying to protect our country;sadness
i suddenly feel a lot smarter and more talented than i did last night;joy
i get into what it actually does i feel like everyone should buy it just because it smells amazing;joy
i feel as though i cant bear the motion of quilting it even though the idea of it delighted me so only a few days ago;joy
i feel heartless now feeling bored and not believe in love anymore;anger
i ended up shoeless making me feel even more vulnerable and slowing me down further;fear
i have been highly critical of dennis covingtons book in this article i must admit that he did say something that has merit in this discussion when he noted in his closing chapters this feeling after god is a dangerous business;anger
i refers of course though i cant help feeling somehow ironically in retrospect to loudons son with kate mcgarrigle the rather talented himself rufus wainwright;joy
i feel lonely few days before my birthday;sadness
i feel like i captured all his sweet looks;joy
i had envisioned and intended im just feeling unsure whether i got that vision and intention right;fear
i feel like i need cute pictures to share;joy
i was feeling so low about myself;sadness
i feel really angry sometimes because for the love of god havent we been through enough;anger
i feel sorry for rafael bosch;sadness
i hope for is that those certain people can attend to more important things in their lives but still come back to blogging if they feel they missed blogging;sadness
i do not feel comfortable staying in my house i feel relentless when im asked to do something tired almost all the time and bored without my own money;joy
i guess im feeling generous today and so i have decided to offer a fabulous deal on of my most popular prints at the moment;joy
i begin to feel unpleasant about anime fandom in general;sadness
i feel tender and disoriented;love
i am feeling really carefree and today was really carefree;joy
i am feeling miserable and sick but hoping that with the amount of sleep i am getting i havent had much choice i have had zero energy cold meds vitamins and lots of fluids i have high hopes to feel better tomorrow;sadness
im feeling cranky and horrible;anger
im more comfortable in a relationship because i wont feel as slutty being with one person having the same amount as i would if i were single or not;love
i feel troubled because of the ongoing relocation of our front door;sadness
i asked him what was making him feel so fabulous and he said i m healthy my family is healthy and we live in a free country;joy
i woke up feeling incredibly content amp optimistic today however i woke up with a terrible cold and a complete lack of energy;joy
im feeling a combination of terrified and relieved;fear
i really feel i was wronged as a patient;anger
i feel that gulam ali is even more talented than many other classical singers;joy
i be the go to guy for someone who wants a genuine guy who would treat them right and spend quality time with them and make them feel special;joy
i think we all feel very passionate about our favorite workout gear and i love seeing what other people love need have to have can t live without so i am hoping you will share your favorites in the comments;love
i feel strange with it because it started to be sale;surprise
i always notice even though she is fabulous at hiding it according to the rest of the world and feel it keenly and am greatly distressed;fear
i feel so shaken and guilty for not being a better mother and shielding my offspring from this health problem;fear
i feel like a greedy little traitor i m looking looking among these covers hey little snotface take me;anger
i feel like i was a rude ass hole at hookah;anger
i feel for my beloved that is reciprocated;love
i feel heartbroken for bryan;sadness
i feel like i had fake everything;sadness
i would feel differently if i believed that the leaders were perfectly truthful;joy
i cant help but feel a longing to be outside more to feel the rain on my skin and sticky tree droppings on my feet;love
i was made to feel like it was my fault that i couldn t control my husband and his violent behavior if they even believed it existed;anger
i feel like its important to reveal lessons youve learned in tough times along with ones youve learned in awesome times when you are endeavoring to build an audience through honesty and authenticity;joy
i feel disgusted when need to act cute like the actions of gwiyomi;anger
i said i feel incredibly thankful on the whole;joy
i feel inspired and eager to press on when the sun shines;joy
im just hoping i can walk by then because my thighs are not feeling at all friendly today;joy
i was feeling nervous sure just like anyone else would be in my position;fear
i was older i might not feel as frightened about spending the time i have left alone;fear
i must say that i feel that i accepted something of a poisoned chalice;love
im an introvert by which i mean i get re energized being alone and preferably in a quiet place so times in the crew galley when there are a lot of people in a relatively small place all talking at once can leave me feeling drained and in need of a dark room with nothing but whale noises;sadness
im feeling generous ill give you a story as well;love
i find this scent pretty generic i actually feel like bath amp bodyworks didnt invest much time in this collection like they created sweet on paris then decided to throw together two other predictable scents;joy
i like the person i have become because i feel so much more carefree and liberated but at the same time i dont recognize myself;joy
